{"$schema":"https://json-schema.org/draft/2020-12/schema","type":"object","additionalProperties":false,"required":["source_id","last_verified_at","last_version_date","current_check_status","notes","checked_by"],"properties":{"source_id":{"type":"string"},"last_verified_at":{"type":["string","null"],"format":"date-time"},"last_version_date":{"type":["string","null"],"format":"date"},"current_check_status":{"enum":["UNCHANGED","POSSIBLY_CHANGED","CHANGED","UNKNOWN"]},"notes":{"type":"string"},"checked_by":{"type":"string","minLength":3}}}
