{
  "checked_by": "Codex official-source review",
  "current_check_status": "UNCHANGED",
  "last_verified_at": "2026-10-08T09:23:25+00:00",
  "last_version_date": "2025-03-11",
  "notes": "Re-opened official source or official indexed act content during Phase 4.5; this check means no source-version change observed for the pinned item.",
  "source_id": "eu-vat-digital-age-directive-2025-516"
}
